{
  "schema_version": "0.1.0",
  "material": {
    "id": "https://w3id.org/battinfo/material/4azv-ppez-1aeg-14yv",
    "material_spec_id": "https://w3id.org/battinfo/spec/5ms1-9jv8-hr54-mn4e",
    "short_id": "4azvpp",
    "lot_id": "CANRUD-LFP-2026-03",
    "supplier": {
      "type": "Organization",
      "name": "Canrud",
      "id": "https://w3id.org/battinfo/organization/9rfa-w6b3-dv1x-vj4z"
    },
    "property": {
      "mass": {
        "value": 19.5,
        "unit": "mg"
      }
    }
  },
  "provenance": {
    "source_type": "lab",
    "retrieved_at": 1781740346
  },
  "notes": [
    "Physical lot of LFP from Canrud (Discovery-Benchmark inventory)."
  ]
}
